ID,Artist,Track,Tags
"5RDUCbvwPZdmjFbhZ5EY4N","MEDUZA","Piece Of Your Heart","House, EDM, electronic, british, dance"
"6AI3ezQ4o3HUoP6Dhudph3","Kendrick Lamar","Not Like Us","MySpotigramBot, Diss, Hip-Hop, diss track, hip hop"
"6ho0GyrWZN3mhi9zVRW7xi","FISHER","Losing It","electronic, dance, techno, tech house, 666"
"2KXwJZv1pRQFQ95Kj60jBN","FISHER","Losing It - Radio Edit","party, 2018 single, bbc radio1 playlist 2018"
"7F1CiKqrY44kh5cDqwHOnx","SLANDER","Love Is Gone - Acoustic","rock"
"4TIkSdsNSfqpuq6ZYvCjAz","Gryffin","All You Need To Know","electronic, pop, EDM, Contemporary pop, future bass"
"19m23w2ANVhtB7rApM6pbN","SLANDER","Back To U","melodic dubstep"
"3BxWKCI06eQ5Od8TY2JBeA","The Pussycat Dolls","Buttons","pop, dance, sexy, rnb, The Pussycat Dolls"
"6r5OaOArztjvur2lSqumAH","The Pussycat Dolls","Top Of The World","pop, dance, The Pussycat Dolls, female vocalists, the city"
"4lZbw23ts5G4nlzGgQbAxc","The Pussycat Dolls","Buttons","pop, dance, sexy, rnb, The Pussycat Dolls"
"0Ev562zA4pmUsBqjxsxxdx","Gryffin","Feel Good","Electronic Pop"
"0aB0v4027ukVziUGwVGYpG","Kendrick Lamar","tv off","mustard, rap, kendrick lamar, west coast hip hop, 2024"
"5UJbgR4XF4y1DvbkxEqe8S","Tate McRae","Sports car","pop, best of 2025, electropop, soty, fernandacoxta"
"2zOmS55knKWSgScYPTNmGQ","Tate McRae","Sports car","pop, best of 2025, electropop, soty, fernandacoxta"
"7MXVkk9YMctZqd1Srtv4MB","The Weeknd","Starboy","rnb, pop, MySpotigramBot, electronic, Daft Punk"
"6qn9YLKt13AGvpq9jfO8py","Rihanna","We Found Love","pop, dance, Rihanna, female vocalists, electronic"
"0U10zFw4GlBacOy9VDGfGL","Rihanna","We Found Love","pop, dance, Rihanna, female vocalists, electronic"
"5UqCQaDshqbIk3pkhy4Pjg","Avicii","Levels - Radio Edit","dance, House, electronic, party, Progressive House"
"6Xe9wT5xeZETPwtaP2ynUz","Avicii","Levels - Original Version","electronic, House, dj, Sweden, EDM"
"0ct6r3EGTcMLPtrXHDvVjc","Avicii","The Nights","dance, electronic, pop, 2015, 2014"
"56v8WEnGzLByGsDAXDiv4d","NewJeans","ETA","baltimore club, pop, k-pop, 2023, catchy"
"1aklRy3btsbucImSXvR2SY","Edward Maya","Stereo Love - Original","pop, dance, eletronic, Romanian popcorn"
"5Y87Aek2DGI5s4WNAh8zKR","Bryson Tiller","502 Come Up","Hip-Hop, soul, rap, rnb, trap"
"1nMKEA5cstslumoTJMVjIu","Louis The Child","Slow Down Love","Soundtrack, steeldrum"
"1aKvZDoLGkNMxoRYgkckZG","ILLIT","Magnetic","Kpop, pluggnb, k-pop, soty, Korean"
"1SNbKSraeBuFBuHeSpHLis","ILLIT","Magnetic","Kpop, pluggnb, k-pop, soty, Korean"
"0znsc67nMhP4X9hjhvoyeP","ILLIT","Tick-Tack","electropop, dance-pop, Awesome, chiptune, Korean"
"3yII7UwgLF6K5zW3xad3MP","Taylor Swift","22","pop, taylor swift, country, love at first listen, female vocalists"
"6rdkCkjk6D12xRpdMXy0I2","NewJeans","New Jeans","k-pop, pop, rnb, love at first listen, UK Garage"
"56v8WEnGzLByGsDAXDiv4d","NewJeans","ETA","baltimore club, pop, k-pop, 2023, catchy"
"5ocSQW5sIUIOFojwXEz9Ki","NewJeans","Supernatural","new jack swing, k-pop, 2024, newjeans, acheimagra"
"65FftemJ1DbbZ45DUfHJXE","NewJeans","OMG","rnb, k-pop, pop, dance-pop, Kpop"
"74X2u8JMVooG2QbjRxXwR8","LE SSERAFIM","Perfect Night","k-pop, 2023, english, pop, Awesome"
"2O4Bb2WCkjlTPO827OnBMI","LE SSERAFIM","EASY","trap, rnb, k-pop, Kpop, easy"
"3AoEQRuFf8zVXWqSLo2UOi","LE SSERAFIM","CRAZY","House, k-pop, Kpop, pop, dance"
"02wk5BttM0QL38ERjLPQJB","NewJeans","Cool With You","UK Garage, k-pop, 2-step, dance-pop, Korean"
"2u9S9JJ6hTZS3Vf22HOZKg","Drake","NOKIA","pop rap, Drake, atlanta bass, pop, electro"
"1aKvZDoLGkNMxoRYgkckZG","ILLIT","Magnetic","Kpop, pluggnb, k-pop, soty, Korean"
"1SNbKSraeBuFBuHeSpHLis","ILLIT","Magnetic","Kpop, pluggnb, k-pop, soty, Korean"
"2O4Bb2WCkjlTPO827OnBMI","LE SSERAFIM","EASY","trap, rnb, k-pop, Kpop, easy"
"5v7oj9PosKdE39x9uwDs6C","ericdoa","dancinwithsomebawdy","dance-pop, funky house, 2-step, funktronica"
"2vxsdAnntt6eGZJJRaLBF6","John Summit","palm of my hands - Odd Mob Remix","tech house, deep house, House"
"17yEueJZhkmMlfWof9Yskf","Bowling For Soup","Cold Shower Tuesdays","punk, punk rock, rock, pop punk, power pop"
"2YAoax0ADUsZO9L4CE35ia","Skepta","Ace Hood Flow","Grime, Hip-Hop, stoka"
"4xZUTExeeaGj3YiEa9RAHv","Skepta","Ace Hood Flow","Grime, Hip-Hop, stoka"
"5rzHkSHRyZUdQcCX6noFDB","ISOxo","SMACK TALK","EDM, bass music, hybrid trap, 2024, edm trap"
"3QuC9rZXdD44FNBg64LFrw","mikeeysmind","VVV","trap, rage, Hypertrap, MySpotigramBot"
"7FUx1SDHG4Im52aKu3iCXC","Homixide Gang","V-Friends","PLUGNB"
"6UhQ7u4SfnkL6upfxj9bQe","Bradley Joseph","Xerxes in G Major, Hwv 40: I. Largo","baroque, piano, Handel"
"6AI3ezQ4o3HUoP6Dhudph3","Kendrick Lamar","Not Like Us","MySpotigramBot, Diss, Hip-Hop, diss track, hip hop"
"1Jo0Zg7XlrA6z0mFTZVdkn","Rihanna","Don't Stop The Music","dance, pop, Rihanna, rnb, female vocalists"
"4evMMKc2HD6fV9slMfgkMx","Playboi Carti","TOXIC","rap, Gangsta Rap, memphis rap, plugg, Southern Hip Hop"
"5vqGU4eGav3JMlwRClgHAv","Playboi Carti","HBA","trap, memphis rap, Gangsta Rap, Hip-Hop, hip hop"
"7fw1teEGCnhl2uPGIGwCHg","Lil Uzi Vert","Sauce It Up","MySpotigramBot, trap, rap, cloud rap, 2017"
"2pPJp3u3mjcqx965L6Ge0C","Drakeo the Ruler","Dawn Toliver","MySpotigramBot, -1001747063611"
"1jKXjxMWlq4BhH6f9GtZbu","Don Toliver","TORE UP","MySpotigramBot, Hip-Hop, skramz, 2024, don toliver"
"12CkTEyYY37XIekrd2bsfs","X-Clan","Aragorn","Hip-Hop, excellence, DL, prolific, lotr"
"3OndGj3vJlBP7lPccg6tNN","SOUL'd OUT","MEGALOPOLIS PATROL","Hip-Hop, j-urban, japan"
"730Sd7tP4eRKvPhQceOPYn","Destroy Lonely","JETLGGD","rage, MySpotigramBot, repetitive, bass, insane"
"2WBHjwYSh04TLOwxgtny1O","Tyler, The Creator","Steak Sauce","rap, Hip-Hop, tyler the creator, hip hop, experimental"
"0WtM2NBVQNNJLh6scP13H8","Rema","Calm Down","afrobeats, summer, 2022, MySpotigramBot, pop"
"0d28khcov6AiegSCpG5TuT","Gorillaz","Feel Good Inc.","alternative, electronic, Hip-Hop, rock, gorillaz"
"7Cq27Qc3WRyQ3ddwVslpVZ","Scarlxrd","Heart Attack","Trap Metal, Hip-Hop, rap, trap, post-nerdcore"
"7wTqEW5nrMhvyEhEyTnOMd","Conan Gray","The Cut That Always Bleeds","seen live, rock, male vocalist, peter, my top songs"
"7C46d7mrdoSsgd3rNOa4A7","Knock2","feel U luv Me","House, electro house, EDM, 2024, bass house"
"0xDSZ754ZOdthmF784uuE5","Knock2","feel U luv Me","House, electro house, EDM, 2024, bass house"
"4wCmqSrbyCgxEXROQE6vtV","Gotye","Somebody That I Used To Know","indie, alternative, electronic, australian, love at first listen"
"1RyioERbWD1Xv5z58Vw9wy","Machine Girl","It Takes a Nation of Millenials to Destroy a Nation of Millions…","electronic, breakcore, anarchism, cannibalism, hardcore breaks"
"0LV2sJDzws0khtyPJ6VD0l","TYNAN","Stay","Colour Bass, dubstep, EDM, festival, bass music"
"7vtRIoGjWGl49gUSULroi8","Kompany","Rapture","dubstep, trap"
"1RyioERbWD1Xv5z58Vw9wy","Machine Girl","It Takes a Nation of Millenials to Destroy a Nation of Millions…","electronic, breakcore, anarchism, cannibalism, hardcore breaks"
"0BgPrNelWyvk0C5recZeKE","Kero Kero Bonito","Sick Beat","electronic, electropop, pop, bitpop, picopop"
"29Dvkvp7Wgd1VJdDvVJlvf","Marshmello","Crusade","electronic, dubstep, Progressive House, english, trap"
"2YAoax0ADUsZO9L4CE35ia","Skepta","Ace Hood Flow","Grime, Hip-Hop, stoka"
"4xZUTExeeaGj3YiEa9RAHv","Skepta","Ace Hood Flow","Grime, Hip-Hop, stoka"
"3c92PetFi2et11Yz5NikgP","monte booker","Kompany","Hip-Hop, electronic, rap, soulection, Ghetto Sage"
"1aklRy3btsbucImSXvR2SY","Edward Maya","Stereo Love - Original","pop, dance, eletronic, Romanian popcorn"
"11Iv8RCFmeImLOpaHYxKb4","Edward Maya","Stereo Love","dance, House, club, electronic, summer 2010"
"6qn9YLKt13AGvpq9jfO8py","Rihanna","We Found Love","pop, dance, Rihanna, female vocalists, electronic"
"2vlDrKpOC0eSTqTDRcbYyw","Calvin Harris","This Is What You Came For","House, EDM, Rihanna, 2016, taylor swift"
"6AI3ezQ4o3HUoP6Dhudph3","Kendrick Lamar","Not Like Us","MySpotigramBot, Diss, Hip-Hop, diss track, hip hop"
"0Ev562zA4pmUsBqjxsxxdx","Gryffin","Feel Good","Electronic Pop"
"4AEzAEnbm9uRgbmTdeI63K","PnB Rock","MIDDLE CHILD","trap, cloud rap, hip hop, pop rap, east coast hip hop"
"3GCdLUSnKSMJhs4Tj6CV3s","Kendrick Lamar","All The Stars","pop rap, contemporary r&b"
"5RDUCbvwPZdmjFbhZ5EY4N","MEDUZA","Piece Of Your Heart","House, EDM, electronic, british, dance"
"2vxsdAnntt6eGZJJRaLBF6","John Summit","palm of my hands - Odd Mob Remix","tech house, deep house, House"
"6geg6XWPAxmwlVl8ZNYns0","Diplo","On My Mind - Purple Disco Machine Remix","remix, pop, dance, techno, tech house"
"5Ohh8csVsOnG7CnDrd2E5W","Sofi Tukker","Purple Hat","Electro Pop, peloton"
"0NTMtAO2BV4tnGvw9EgBVq","Rihanna","Bitch Better Have My Money","hip hop, urban, 2015, r8, Hip-Hop"
"1jo3TwNGCXfNdB5uba3ZVv","Eminem","Killshot","rap, Hip-Hop, Diss, Eminem, MySpotigramBot"
"3iVcZ5G6tvkXZkZKlMpIUs","Kendrick Lamar","Alright","MySpotigramBot, jazz rap, Conscious Hip Hop, Hip-Hop, 2015"
"4ZlcezbAuIfO400BvhlvtD","Ray Volpe","SONG REQUEST","dubtep"
"7hBUvEg6V9TQPZgLie2krb","Ray Volpe","SEE YOU DROP","dubstep, Brostep, briddim, electronic, festival"
"7KJ4sdjdKQdXgM47Ifd5RK","Ray Volpe","IT ISN'T ME","EDM, monstercat, future bass, electronic, pop"
"6AI3ezQ4o3HUoP6Dhudph3","Kendrick Lamar","Not Like Us","MySpotigramBot, Diss, Hip-Hop, diss track, hip hop"
"4ZJ4vzLQekI0WntDbanNC7","Zach Bryan","Pink Skies","colors, pink, the color pink"
"0U87auHx1iZTEFcq9KVdmO","Green Day","Boulevard of Broken Dreams","rock, punk rock, green day, punk, alternative"
"2HbKqm4o0w5wEeEFXm2sD4","Kendrick Lamar","Money Trees","MySpotigramBot, rap, Hip-Hop, hip hop, west coast hip hop"
"3CRDbSIZ4r5MsZ0YwxuEkn","Twenty One Pilots","Stressed Out","indie pop, alternative, indie, alternative hip hop, hip hop"
"5OGIJnhky1kQVQJz33QR2W","Hoodie Allen","Sushi","rap"
"1z9EbieFSoVLz7A3Q2DCiu","Snoop Dogg","Murder Was The Case","Hip-Hop, rap, Gangsta Rap, Snoop Dogg, hip hop"
"2NBQmPrOEEjA8VbeWOQGxO","Snoop Dogg","Drop It Like It's Hot","rap, Hip-Hop, Snoop Dogg, hip hop, Gangsta Rap"
"0lOe1dR2TNkJMCjIcRuw6T","The Game","Westside Story","Hip-Hop, Gangsta Rap, rap, 2000s, Dr. Dre"
"2d8JP84HNLKhmd6IYOoupQ","Fetty Wap","Trap Queen","Hip-Hop, rap, Dope Shit, trap, hip hop"
"1HComaUOXdl7jRuGB3KsVB","Crankdat","Open The Pit","Hip-Hop, electronic, rap, dubstep, EDM"
"0J6NISt5LmV0I0kHqk3Jc0","Fetty Wap","Trap Queen","Hip-Hop, rap, Dope Shit, trap, hip hop"
"6nzXkCBOhb2mxctNihOqbb","M.I.A.","Bad Girls","Hip-Hop, electronic, alternative, female vocalists, swag"
"33qZHFJnbQz3rKm50fSpDB","Yard Act","Tall Poppies","post-punk, spoken word, Crank wave, rock, punk"
"45XhKYRRkyeqoW3teSOkCM","DJ Khaled","Wild Thoughts","Rihanna, Hip-Hop, rnb, Maria Maria, Bryson Tiller"
"5uWLuFDmMs1r44KFfUwWiA","Lord Echo","Thinking Of You","reggae, cover, Disco, soul, laidback"
"67T6l4q3zVjC5nZZPXByU8","Jason Derulo","Whatcha Say","pop, Jason Derulo, rnb, watcha say, whatcha say"
"6H0gZ1R4W9tIbb6HVvjNEe","Jason Derulo","Acapulco","american, party, playlista rmf fm, linedance 2023"
"4vLBnQtece15fFhqWxZvJP","Wilbur Soot","Your New Boyfriend","minecraft, Scottish, beauty, funny, ironic"
"7KXjTSCq5nL1LoYtL7XAwS","Kendrick Lamar","HUMBLE.","rap, Hip-Hop, hip hop, trap, MySpotigramBot"
"3fqwjXwUGN6vbzIwvyFMhx","Chris Stapleton","Tennessee Whiskey","country, blues, fip, folk, singer-songwriter"
"6Knv6wdA0luoMUuuoYi2i1","Flo Rida","My House","pop, 2015, Hip-Hop, 2010s, 2016"
"26rdOwwjC2UnweK3xeS58u","Flo Rida","GDFR","n-a"
"3Y0FFtcmxdGkrCKnvuOs5q","ISOKNOCK","TROUBLE","nu skool breaks, bass house, trap edm, drift phonk"
"4llK75pXNWZz6KAho2Gp16","Maroon 5","She Will Be Loved - Radio Mix","pop, rock, alternative rock, pop rock, soft rock"
"1SAkL1mYNJlaqnBQxVZrRl","Sir Mix-A-Lot","Baby Got Back","rap, Hip-Hop, 90s, old school, hip hop"
"5rzHkSHRyZUdQcCX6noFDB","ISOxo","SMACK TALK","EDM, bass music, hybrid trap, 2024, edm trap"
"4XcphMBEv10k6Ob1Z2guUi","ISOxo","SMACK TALK","EDM, bass music, hybrid trap, 2024, edm trap"
"5NYiAtgAFWCwEpfSZOHFA7","RL Grime","I Wanna Know","electronic, pop, trap, EDM, future bass"
"6AI3ezQ4o3HUoP6Dhudph3","Kendrick Lamar","Not Like Us","MySpotigramBot, Diss, Hip-Hop, diss track, hip hop"
"1bM50INir8voAkVoKuvEUI","USHER","OMG","Usher, omg, pop, rnb, r&b"
"55lEGZSpEFxp6RaUVIExTX","Daddy Yankee","Plane To P.R.","Reggaeton"
"3wyrhwPpV8uhMMEms4vG3X","BTS","Not Today","Kpop, Korean, k-pop, bts, hip hop"
"6OeYM2861GaP3D1pbBqmbp","BTS","Skit: Billboard Music Awards Speech","2017"
"2ZqTbIID9vFPTXaGyzbb4q","Megan Thee Stallion","Neva Play","fuck feat tags"
"0fK7ie6XwGxQTIkpFoWkd1","JENNIE","like JENNIE","funk mandelao, peter, funk automotivo, funk, phonk"
"6CIt7KJVCgSz0mle8HzjBl","JENNIE","like JENNIE","funk mandelao, peter, funk automotivo, funk, phonk"
"2wVDWtLKXunswWecARNILj","JENNIE","SOLO","k-pop, Kpop, pop, better than selena gomez, blackpink"
"0fK7ie6XwGxQTIkpFoWkd1","JENNIE","like JENNIE","funk mandelao, peter, funk automotivo, funk, phonk"
"6V3dOOUiPg53wUf83tBLR8","JENNIE","SOLO - Live","the show"
"2hKdd3qO7cWr2Jo0Bcs0MA","Train","Drops of Jupiter","rock, alternative, pop, alternative rock, train"
"3IelG5zYpWWCZIH4cqWlPV","XG","SHOOTING STAR","Hip-Hop, pop, k-pop, j-pop, fire"
"1z9kQ14XBSN0r2v6fx4IdG","Rihanna","Diamonds","pop, Rihanna, diamonds, rnb, 2012"
"0PvFJmanyNQMseIFrU708S","Pop Smoke","For The Night","my scribbled"
"1QPV3QoWw3rRKPeYoX8kO8","YEONJUN","GGUM","Awesome, Hip-Hop, hiphop, insane, gay"
"2DbDefRFJ5YOfXCKOeCJJh","KISS OF LIFE","Igloo","english, hot, trap, Kpop, bside"
"0dzbNEBsrs17os3jJOFLar","XG","IS THIS LOVE","pop, Awesome, Favorite, miami bass, soty"
"2u9S9JJ6hTZS3Vf22HOZKg","Drake","NOKIA","pop rap, Drake, atlanta bass, pop, electro"
"7HfDulyv4KLZAD170lF8at","XG","IS THIS LOVE","pop, Awesome, Favorite, miami bass, soty"
"09keT5ocFhEd5W5HidiUNq","Stray Kids","Chk Chk Boom","Korean, Kpop, k-pop, Hip-Hop, rap"
"5yye6RvxPOo8YU0fYWQpNn","Stray Kids","Chk Chk Boom","Korean, Kpop, k-pop, Hip-Hop, rap"
"6k67RdkVjTZj79c1cRz7IQ","ATEEZ","WONDERLAND","k-pop, Kpop, energy, Awesome, Korean"
"27JQxefJsCVa6xTbEFBVXG","BE:FIRST","Hush-Hush","Awesome, Favorite, crazy good, MySpotigramBot"
"2KoeSRTm9cRulYnkaEyUaP","ATEEZ","Crazy Form","funk, Awesome, k-pop, Favorite, boy group"
"3VHD84tIdyxRTtRc167YSR","ATEEZ","WORK","k-pop, Hip-Hop, Awesome, hiphop, Korean"
"62eDE0RR8Sgh7yw8ZLeyAM","ATEEZ","Ice On My Teeth","k-pop, Hip-Hop, hip hop, Awesome, Korean"
"2bSk87AVkCIIC3Bcligq1z","Lil Baby","Life Goes On","MySpotigramBot, hip hop, rap, trap, trap rap"
"2QAFTMHp7NeuyM6P2SiB7U","ATEEZ","Ice On My Teeth","k-pop, Hip-Hop, hip hop, Awesome, Korean"
"5dntGTbUtmUO239wQ0k3yM","KAI","Mmmh","rnb, krnb, chill, sexy, Awesome"
"6AI3ezQ4o3HUoP6Dhudph3","Kendrick Lamar","Not Like Us","MySpotigramBot, Diss, Hip-Hop, diss track, hip hop"
"6bc8VmlNt5S9WJlyw8bBdd","WayV","Love Talk","C-pop, mandopop, Awesome, r&b, rnb"
"3GCdLUSnKSMJhs4Tj6CV3s","Kendrick Lamar","All The Stars","pop rap, contemporary r&b"
"0UzymivvUH5s8z4PeWZJaK","ENHYPEN","FEVER","Kpop, enhypen, pop, reggae, sexy"
"3gTQwwDNJ42CCLo3Sf4JDd","Stray Kids","S-Class","k-pop, soty, Hip-Hop, Awesome, Korean"
"09keT5ocFhEd5W5HidiUNq","Stray Kids","Chk Chk Boom","Korean, Kpop, k-pop, Hip-Hop, rap"
"7mpdNiaQvygj2rHoxkzMfa","ENHYPEN","Bite Me","Awesome, Korean, k-pop, Favorite, lesbian"
"68qeaZhtMZ6abrJCYt6nQn","Playboi Carti","RATHER LIE","AI, trap, pop rap, cloud rap, plugg"
"3QLjDkgLh9AOEHlhQtDuhs","Drake","Best I Ever Had","Drake, Hip-Hop, Best I Ever Had, rap, hip hop"
"4AcScHuxr9xAqqyxxTMAhu","Drake","Best I Ever Had","Drake, Hip-Hop, Best I Ever Had, rap, hip hop"
"1G7DcLzPnopdZjLkev0K4e","Beyonce","Irreplaceable","rnb, beyonce, pop, female vocalists, soul"
"5IVuqXILoxVWvWEPm82Jxr","Beyonce","Crazy In Love","pop, rnb, beyonce, female vocalists, Hip-Hop"
"6jG2YzhxptolDzLHTGLt7S","Beyonce","Drunk in Love","pop, beyonce, Hip-Hop, rnb, jay z"
"3jdh7YQBCxykbhL7z0Ehu5","2Pac","Runnin'","Hip-Hop, hip hop, rap, 2pac"
"5aWlEuY1dSo4uVJgHz5reX","50 Cent","What If","rap, Hip-Hop, hip hop, new york, 50 Cent"
"58FUwmyGUqkt53YPUcm7cJ","Keri Hilson","Knock You Down","keri hilson, rnb, female vocalists, Love, pop"
"3Tzqc58mXuVnyaGq5tEm6q","Chris Brown","Wait","soul, sexy, rnb, Hip-Hop, urban"
"54tYe1zs0Pcx3ueWtBSDNv","Keri Hilson","Knock You Down","keri hilson, rnb, female vocalists, Love, pop"
"6pWzCKTrKrwbUPzY8RLCoP","Ashanti","Rock Wit U","rnb, 2003, american, r&b"
"5rb9QrpfcKFHM1EUbSIurX","USHER","Yeah!","rnb, Hip-Hop, dance, Usher, hip hop"
"0neiNeigCzkWQPeaBKvFmq","USHER","Yeah!","rnb, Hip-Hop, dance, Usher, hip hop"
"4IHnAK9KToQkaJRCh3fnIf","USHER","Yeah!","rnb, Hip-Hop, dance, Usher, hip hop"
"3SKH53SPQbEnZR4cJPVaz2","Lola Young","Messy","indie rock, rock, british, Neo-Psychedelia, Post-punk revival"
"35ISBknsCeZQtq66xABI9g","Lola Young","Messy","indie rock, rock, british, Neo-Psychedelia, Post-punk revival"
"2yPoXCs7BSIUrucMdK5PzV","Rihanna","Umbrella","pop, Rihanna, rnb, female vocalists, dance"
"49FYlytm3dAAraYgpoJZux","Rihanna","Umbrella","pop, Rihanna, rnb, female vocalists, dance"
"7pAAD4l4zBdjz46PHL6OFT","The Game","My Turn","Gangsta Rap, the game, rap, west coast, West Coast Rap"
"4356Typ82hUiFAynbLYbPn","USHER","DJ Got Us Fallin' In Love","dance, pop, rnb, electronic, Usher"
"4IFYR5smTnHYCLP82AiDrJ","Tamia","Officially Missing You","tamia, rnb, female vocalists, slow jams, quiet storm"
"3c6afiysmB7OnxQzzSqRfD","Tamia","So Into You","rnb, soul, 90s, slow jams, tamia"
"7CkjU55ROZSwb95dzGan0o","Geeks","Officially Missing You","global fusion, chill906"
"2kQuhkFX7uSVepCD3h29g5","Akon","Smack That","Hip-Hop, Akon, rap, hip hop, dance"
"2q4rjDy9WhaN3o9MvDbO21","Soulja Boy","Kiss Me Thru The Phone","Hip-Hop, Soulja Boy, rap, kiss me thru the phone, r&b"
"0PkKjUWfXzvyYdsQsHJ2bi","Tyga","Dad's Letter","rap, Hip-Hop, 2010s, Eddy-kay"
"6Hn9Uc1mMNfqChXU3txNke","Ne-Yo","Mad","rnb, Ne-Yo, soul, r&b, mad"
"7I6DceMT3utDOHjcYCbrr4","Akon","Don't Matter","rnb, Akon, Hip-Hop, hip hop, rap"
"6eDTficajELq28coX76d1G","Akon","Don't Matter","rnb, Akon, Hip-Hop, hip hop, rap"
"1vwUsp52io0AGQ5yv470IC","Chris Brown","Take You Down","rnb, sexy, r&b, hip hop, slow jamz"
"3eze1OsZ1rqeXkKStNfTmi","Chance the Rapper","Juke Jam","justin bieber, towkio"
"3riRdhyMDfEQz5nKrxfbwv","Leon Thomas","MUTT","soul, rnb, Neo-Soul, hip hop soul, my top songs"
"1RGIjMFMgJxkZHMDXVYzOJ","T-Pain","Bartender","Hip-Hop, rap, T-Pain, rnb, relaxing"
"6bDwbLytoFQF5OiSD3TeX4","T-Pain","Bartender","Hip-Hop, rap, T-Pain, rnb, relaxing"
"2iclfHORMqpR3TxuhwVRhD","Ja Rule","Mesmerize","Hip-Hop, rap, rnb, hip hop, 2003"
"4R6OANdWnhMM9Asu3zjxK6","Ja Rule","Mesmerize","Hip-Hop, rap, rnb, hip hop, 2003"
"4fINc8dnfcz7AdhFYVA4i7","Jason Derulo","It Girl","pop, rnb, 2011, 2010s, dance"
"67T6l4q3zVjC5nZZPXByU8","Jason Derulo","Whatcha Say","pop, Jason Derulo, rnb, watcha say, whatcha say"
"7BS72CMAHCX9b6MAfoeamG","Jason Derulo","It Girl","pop, rnb, 2011, 2010s, dance"
"5Lgcn7u07bHuqbOtXkN62u","Chris Brown","With You","rnb, Chris Brown, Love, Hip-Hop, pop"
"62zFEHfAYl5kdHYOivj4BC","Pitbull","International Love","pop, Pitbull, dance, Chris Brown, rap"
"4CMrdHWqic0usIZfTrKoI3","DaniLeigh","Easy","rnb, Hip-Hop, rap, urban, trap"
"3XVBdLihbNbxUwZosxcGuJ","Alicia Keys","If I Ain't Got You","soul, rnb, female vocalists, Alicia Keys, piano"
"0ARK753YaiJbpLUk7z5yIM","Nelly","Dilemma","rnb, Hip-Hop, Nelly, rap, hip hop"
"14MgTooapmJdLlEMAr2zAM","Nelly","Dilemma","rnb, Hip-Hop, Nelly, rap, hip hop"
"4bUfMNNmiCmPXVyWzIfKeZ","Nelly","E.I.","rap, Hip-Hop, Nelly, hip hop, rnb"
"10aWGOqSDBqvNzJ9NeKDbK","Ne-Yo","Sexy Love","rnb, Ne-Yo, soul, r&b, Sexy Love"
"4QNpBfC0zvjKqPJcyqBy9W","Pitbull","Give Me Everything","dance, pop, 2011, 2010s, Ne-Yo"
"7xCPr7Q1HAfCbvvvSs7dtF","Ne-Yo","Sexy Love","rnb, Ne-Yo, soul, r&b, Sexy Love"
"1KGi9sZVMeszgZOWivFpxs","TLC","No Scrubs","rnb, 90s, pop, female vocalists, Hip-Hop"
"3NpsJc5SOINskuK3z08Q9C","TLC","No Scrubs","rnb, 90s, pop, female vocalists, Hip-Hop"
"68vgtRHr7iZHpzGpon6Jlo","USHER","My Boo","rnb, Usher, my boo, soul, Alicia Keys"
"3PeiHmqvHIAZQ7lJHIKUQZ","USHER","My Boo","rnb, Usher, my boo, soul, Alicia Keys"
"7H6ev70Weq6DdpZyyTmUXk","Destiny's Child","Say My Name","rnb, pop, destinys child, female vocalists, 90s"
"6WAhLCL1XchQzYjl15rnFp","Destiny's Child","Say My Name","rnb, pop, destinys child, female vocalists, 90s"
"4iZ4pt7kvcaH6Yo8UoZ4s2","SZA","Snooze","rnb, sza, Neo-Soul, trip hop, american"
"5YABYtKx9qa56vBjlXDbmw","SZA","Snooze","rnb, sza, Neo-Soul, trip hop, american"
"75on2JOaUTVhYyCKrNNClY","SZA","Snooze","rnb, sza, Neo-Soul, trip hop, american"
"34ceTg8ChN5HjrqiIYCn9Q","Ne-Yo","Miss Independent","rnb, Ne-Yo, pop, r&b, male vocalists"
"5pFHghfHQFUUt3CGzoxOM0","Ne-Yo","Miss Independent","rnb, Ne-Yo, pop, r&b, male vocalists"
"5W7BcYDIaeXnpG3e39T7hJ","Lil Wayne","How To Love","Hip-Hop, Lil Wayne, hip hop, 2011, rap"
"6AI3ezQ4o3HUoP6Dhudph3","Kendrick Lamar","Not Like Us","MySpotigramBot, Diss, Hip-Hop, diss track, hip hop"
"4c5Cd6pkg7qqzSAXjsBapX","Lil Wayne","How To Love","Hip-Hop, Lil Wayne, hip hop, 2011, rap"
"3LmvfNUQtglbTrydsdIqFU","Mariah Carey","We Belong Together","Mariah Carey, pop, rnb, female vocalists, soul"
"3sTWGcvCD0u2aqTMuIE9cy","Girl Talk","Too Deep","Hip-Hop, mashup, electronic, dance, mash-up"
"3QaPy1KgI7nu9FJEQUgn6h","Billie Eilish","WILDFLOWER","edu e marco, peter, pop, dream pop, indie folk"
"6g6W3pMAFbp2FS1QCijkpM","Kendrick Lamar","Super Bowl LIX Halftime Show - Live","kendrick lamar, simon-approved"
"75bsrBtmM57lhi55yOfzBL","Kendrick Lamar","tv off","mustard, rap, kendrick lamar, west coast hip hop, 2024"
"0FIDCNYYjNvPVimz5icugS","The Weeknd","Timeless","pop punk, trap, pop rap, furry, new jazz"
"0aB0v4027ukVziUGwVGYpG","Kendrick Lamar","tv off","mustard, rap, kendrick lamar, west coast hip hop, 2024"
"6g6W3pMAFbp2FS1QCijkpM","Kendrick Lamar","Super Bowl LIX Halftime Show - Live","kendrick lamar, simon-approved"
"60wwxj6Dd9NJlirf84wr2c","Zedd","Clarity","electronic, House, pop, love at first listen, dance"
"2Nf0RbvVIKcL0SbEziqArb","Zedd","Clarity - Zedd Union Mix","remix, pop, dance, Love, orchestra"
"2QtJA4gbwe1AcanB2p21aP","Zedd","Stay The Night - Featuring Hayley Williams Of Paramore","dance, House, 2013, zedd, hayley williams"
"7HDq8aEtkBeZq7gfzYjW28","GELO","Tweaker","rap, male vocalists, 2025, hit song, tweaking"
"2nW48vXnZZ5EYka46v7GOk","NewJeans","Attention","k-pop, contemporary rnb, dance-pop, rnb, pop"
"3muBQDekYAg7jm6hDu6R0Z","Tee Grizzley","First Day Out","tee grizzley"
"44jt5m1pRE0rI4VixZbWF6","PSYCHIC FEVER from EXILE TRIBE","Just Like Dat feat. JP THE WAVY","japanese, r&b, male vocalists, j-pop, english"
"1BxfuPKGuaTgP7aM0Bbdwr","Taylor Swift","Cruel Summer","electropop, synthpop, pop, overrated, industrial pop"
"7j2CbKwtEcDbVDzdJ99kOy","Killah Priest","Intro Blackball Me","favorites, wu-tang, underrated"
"7wCWK3AapKQoHZbghyIrP4","Tinashe","Nasty","rnb, pop rap, contemporary rnb, pop, hyphy"
"3QuC9rZXdD44FNBg64LFrw","mikeeysmind","VVV","trap, rage, Hypertrap, MySpotigramBot"
"7FUx1SDHG4Im52aKu3iCXC","Homixide Gang","V-Friends","PLUGNB"
"6PrPWf02VxGUd2jJLs9z1M","Sara Landry","Play With Me","techno, hard techno, Industrial Techno, Sabrina Carpenter, madison beer"
"0aMonkh8OKgqx1K0viRHRT","Sara Landry","Legacy","techno, hard techno, mainstream techno, Sabrina Carpenter, madison beer"
"79nRqde4cRssDzkJcu275a","Sara Landry","Heaven","hard techno, EDM, Industrial Techno, dance, techno"
"1cGpjqxs56wNKE6LOBnUcD","The New Mastersounds","Freckles","funk, indie, british, funky, Discovery"
"4R7zWSh3kH7mAftCc1SUg1","Miles Davis","Godchild","jazz, trumpet, cool jazz, miles davis, bebop"
"5uh8m2Lna0Gfk8YGqYVb6d","Knock2","Make U SWEAT!","dance, House, electro house, club, party"
"5btHH7mz37HogkGO78bTZT","112","Peaches & Cream","rnb, r&b, 112, Hip-Hop, dance"
"3noBBoCUf6exZlsGmXiNdN","Knock2","Make U SWEAT!","dance, House, electro house, club, party"
"3tFed7YsjGnIfxeLEQwx3R","Tyler, The Creator","Sticky","Lil Wayne, Sexyy Red, banger, tyler the creator, 2024"
"3GPmn3HANnZTlEovc2J9nt","Knock2","hold my hand","electronic, pop, dance, House, electro house"
"1fOkmYW3ZFkkjIdOZSf596","Frank Ocean","Pink Matter","Neo-Soul, MySpotigramBot, def jam, soul, rnb"
"7EZzLjvLJlAbOixtiExeE8","Knock2","hold my hand","electronic, pop, dance, House, electro house"
"6YMS54sTNvPXAEvB9vfUSW","Knock2","GEMS","130-bpm"
"5PkWhNfVEz2O9n8b6cQFMw","Knock2","Rock Ur World","House, electro house, EDM"
"4FKRT4uPFx2L4exy9DCs1o","Knock2","dashstar* - VIP","electronic, House, electro house, club, party"
"3414vfp4uaJNFqFFj9sUvz","JMSN","'Bout It","hear me out, WSUM 91.7 FM Madison, Jasmine "
"6dOtVTDdiauQNBQEDOtlAB","Billie Eilish","BIRDS OF A FEATHER","alt-pop, 2024, peter, pop, indie pop"
"1HComaUOXdl7jRuGB3KsVB","Crankdat","Open The Pit","Hip-Hop, electronic, rap, dubstep, EDM"
"0v1nobrUSVLIXrYaI4zwkw","Crankdat","STFU","dubstep, Brostep, electronic, dance, House"
"2K1Grx3at2GH9ErGX1o9NV","Crankdat","Whiplash","electro house, EDM, 2025, Brostep, bass house"
"5PkWhNfVEz2O9n8b6cQFMw","Knock2","Rock Ur World","House, electro house, EDM"
"4FKRT4uPFx2L4exy9DCs1o","Knock2","dashstar* - VIP","electronic, House, electro house, club, party"
"5PkWhNfVEz2O9n8b6cQFMw","Knock2","Rock Ur World","House, electro house, EDM"
"4FKRT4uPFx2L4exy9DCs1o","Knock2","dashstar* - VIP","electronic, House, electro house, club, party"
"5uh8m2Lna0Gfk8YGqYVb6d","Knock2","Make U SWEAT!","dance, House, electro house, club, party"
"77MlbRsFh9nlS3G3OPh7HA","D Double E","Street Fighter Riddim","Grime, electronic, rap, dubstep, breakbeat"
"7LR85XLWw2yXqKBSI5brbG","JAY-Z","Run This Town","Hip-Hop, rap, Rihanna, hip hop, jay-z"
"1fDsrQ23eTAVFElUMaf38X","Don McLean","American Pie","classic rock, 70s, folk, singer-songwriter, rock"
"6xFUUsCrqKcel4mjpLQJPw","B-Legit","The Hemp Museum","rap, Gangsta Rap, West Coast Rap, weed, Bay Area Classic"
"7tI8dRuH2Yc6RuoTjxo4dU","Jimin","Who","homosexual, soty, bots, bot, jimin"
"0kKEqUC0N7cghbCEr0boVQ","Avant","Body Police","rnb, rhythum and blues tag, eddy-kaylove it"
"3xrdlyNFDCtgbuYyaWxZyW","Insan3lik3","The Other Day","electronic, dubstep, electro house, EDM, complextro"
"4ChomJf8z16E6Zw4EoioYY","Kehlani","After Hours","pop, rnb, 2000s, Kpop, my top songs"
