ID,Artist,Track,Tags
"5Nt2FMqnKI2mlp7lztURNo","Jordan Adetunji","KEHLANI","rnb, jersey club, future beats, kehlani"
"6C2nVSSeXNqfoY8t6tliZ4","2hollis","jeans","witch house, rage, hyperpop, outsider house, digicore"
"2GWoYTVa8Q7HvmqoW5kVvz","The Autocollants","Apple Vines","drums, Lo-Fi, sean hayes, Indie-Electro-Rock, WSUM 91.7 FM Madison"
"1RGIjMFMgJxkZHMDXVYzOJ","T-Pain","Bartender","Hip-Hop, rap, T-Pain, rnb, relaxing"
"6bDwbLytoFQF5OiSD3TeX4","T-Pain","Bartender","Hip-Hop, rap, T-Pain, rnb, relaxing"
"1bM50INir8voAkVoKuvEUI","USHER","OMG","Usher, omg, pop, rnb, r&b"
"4356Typ82hUiFAynbLYbPn","USHER","DJ Got Us Fallin' In Love","dance, pop, rnb, electronic, Usher"
"68vgtRHr7iZHpzGpon6Jlo","USHER","My Boo","rnb, Usher, my boo, soul, Alicia Keys"
"3PeiHmqvHIAZQ7lJHIKUQZ","USHER","My Boo","rnb, Usher, my boo, soul, Alicia Keys"
"5rb9QrpfcKFHM1EUbSIurX","USHER","Yeah!","rnb, Hip-Hop, dance, Usher, hip hop"
"4IHnAK9KToQkaJRCh3fnIf","USHER","Yeah!","rnb, Hip-Hop, dance, Usher, hip hop"
"41PWz0hAiU9FqsmjR9Wh62","Lil Jon & The East Side Boyz","Lovers And Friends","rap, Crunk, Hip-Hop, hip hop, Gangsta Rap"